code_name,ticker,created_at,text
恒瑞医药,sh.600276,2021-11-10,"恒瑞医药股价波动原因：恒瑞医药股价今天出现较大波动，可能是因为公司发布了多笔大宗交易公告，涉及980.17万股，成交金额达5.17亿元。此外，公司子公司上海恒瑞医药有限公司收到国家药品监督管理局核准签发关于SHR2285片的《药物临床试验批准通知书》，将进一步推动公司药品研发进程。同时，公司还参加了医保谈判，市场对于公司药品纳入医保目录的预期也可能是影响股价的因素之一。
"
恒瑞医药,sh.600276,2021-11-10,"医药行业发展趋势：医药行业是一个重要的民生行业，随着人们生活水平的提高和老龄化趋势的加剧，对于医药产品和服务的需求将持续增长。此外，近年来国家出台了一系列政策鼓励医药创新，推动医药行业向高质量发展转型。同时，由于医药行业涉及到药品研发、生产、流通、销售等多个环节，因此行业内部的竞争也十分激烈。
"
恒瑞医药,sh.600276,2021-11-10,外资投资中国市场：近年来，外资对于中国市场表现出越来越浓厚的兴趣，其中医药行业也是一个重要的投资领域。外资投资中国市场的原因包括中国经济的快速发展、庞大的市场规模以及不断优化的营商环境等。同时，外资的进入也有助于推动中国医药行业的发展，提高行业竞争力和国际化水平。
