code_name,ticker,created_at,text
恒瑞医药,sh.600276,2025-12-10,恒瑞医药于2025年12月10日发布海外监管公告，内容为第九届董事会第二十一次会议决议公告。该公告根据香港联交所上市规则第13.10B条刊发，并载列了公司在上海证券交易所网站发布的公告。公告同时披露了董事会成员名单，包括执行董事孙飘扬、戴洪斌、冯佶、张连山、江宁军、孙杰平，非执行董事郭丛照，以及独立非执行董事董家鸿、曾庆生、孙金云、周纪恩。
恒瑞医药,sh.600276,2025-12-10,原文信息不足，无法形成完整摘要。
恒瑞医药,sh.600276,2025-12-10,恒瑞医药于2025年12月10日发布海外监管公告，通知召开2025年第二次临时股东会。该公告根据香港联交所证券上市规则第13.10B条刊发，并已同步在上海证券交易所网站披露。公告列示了董事会成员信息，包括执行董事孙飘扬、戴洪斌等。
恒瑞医药,sh.600276,2025-12-10,恒瑞医药于2025年12月10日发布通函，建议修订《公司章程》，包括增加“药品包装材料和药品包装制品的研发、制造与销售”经营范围，并取消监事会，其职权由董事会审计委员会行使。该修订须经2025年第二次临时股东会审议批准，股东会定于2025年12月31日举行。
恒瑞医药,sh.600276,2025-12-10,恒瑞医药（股份代号1276）将于2025年12月31日下午2时30分在上海浦东新区海科路1288号召开2025年第二次临时股东会。会议主要审议特别决议案：批准修订《公司章程》。本次股东会决议案将以投票方式表决，H股股东需在2025年12月23日16时30分前完成过户登记，12月24日至31日暂停H股过户登记。
恒瑞医药,sh.600276,2025-12-10,恒瑞医药发布2025年第二次临时股东会适用的代表委任表格。该股东会将于2025年12月31日下午二时三十分在上海浦东新区海科路1288号举行，审议事项包括建议修订公司《公司章程》。H股股东可委任代表出席并投票，代表委任表格须不迟于2025年12月30日下午二时三十分送达公司H股股份过户登记处。
恒瑞医药,sh.600276,2025-12-10,恒瑞医药于2025年12月10日召开董事会，建议修订《公司章程》，包括在经营范围中增加“药品包装材料和药品包装制品的研发、制造与销售”，并取消监事会，原监事会职权由董事会审计委员会行使。此外还包括更新注册资本等其他内务变更。该修订需经临时股东大会审议批准及市场监管机构登记后生效。
