code_name,ticker,created_at,text
恒瑞医药,sh.600276,2025-10-14,恒瑞医药（股份代号：1276）于2025年10月13日发布H股公告，宣布董事会会议将于2025年10月27日举行，会议将审议及批准公司及其附属公司截至2025年9月30日止九个月的季度业绩及其发布。公告同时列出了董事会成员名单。
恒瑞医药,sh.600276,2025-10-14,"恒瑞医药于2025年10月13日通过上海证券交易所购回170,000股A股，用于员工持股计划，购回价格区间为每股66.18元至67.01元，总金额约11,352,700元。购回后，公司已发行股份（不含库存股）为6,364,891,264股，库存股份增至14,111,010股。上述购回已获董事会授权并符合相关规则。"
恒瑞医药,sh.600276,2025-10-14,原文信息不足，无法形成完整摘要。
恒瑞医药,sh.600276,2025-10-14,原文信息不足，无法形成完整摘要。
恒瑞医药,sh.600276,2025-10-14,原文信息不足，无法形成完整摘要。
恒瑞医药,sh.600276,2025-10-14,"恒瑞医药于2025年10月14日披露翌日报表，显示公司通过上海证券交易所购回200,000股A股，每股购回价区间为64元至67元，总金额13,066,300元，所购股份拟持作库存股份用于员工持股计划。购回后，已发行股份（不含库存）减少至6,364,691,264股，库存股份增至14,311,010股，公司总股份不变。"
