code_name,ticker,created_at,text
恒瑞医药,sh.600276,2025-09-24,原文信息不足，无法形成完整摘要。
恒瑞医药,sh.600276,2025-09-24,原文信息不足，无法形成完整摘要。
恒瑞医药,sh.600276,2025-09-24,原文信息不足，无法形成完整摘要。
恒瑞医药,sh.600276,2025-09-24,"恒瑞医药于2025年9月23日通过上海证券交易所购回1,298,000股A股，每股购回价区间为68.7元至70元，付出价格总额约89,935,566.6元。购回股份拟持作库存股份，用于A股员工持股计划。购回后，已发行股份（不含库存）从6,369,489,964股变为6,368,191,964股，库存股份从9,512,310股增至10,810,310股。"
恒瑞医药,sh.600276,2025-09-24,"恒瑞医药于2025年9月24日披露其股份变动情况。公司当日通过上海证券交易所回购140,000股A股，回购价格区间为每股69.3元至69.6元，总金额约972.52万元。本次回购的股份将作为库存股份用于员工持股计划。回购后，公司已发行股份（不含库存股）减至6,368,051,964股，库存股份增至10,950,310股。公司确认本次回购已获董事会授权并符合相关法规。"
恒瑞医药,sh.600276,2025-09-24,恒瑞医药于2025年9月24日与Glenmark Specialty S.A.签署瑞康曲妥珠单抗项目授权许可协议。根据协议，恒瑞医药授予Glenmark Specialty在指定区域（包括美国、加拿大等）独家开发、生产和商业化该药物的权利。恒瑞医药将获得首付款、里程碑付款及销售提成。该药物为靶向HER2的ADC药物，已在中国获批用于特定适应症，并有多项临床研究进行中。协议旨在推动该药物的国际化发展。
