code_name,ticker,created_at,text
恒瑞医药,sh.600276,2025-12-25,原文信息不足，无法形成完整摘要。
恒瑞医药,sh.600276,2025-12-25,原文信息不足，无法形成完整摘要。
恒瑞医药,sh.600276,2025-12-25,"恒瑞医药于2025年12月召开第二次临时股东会，审议《公司章程修正案》。拟增加“药品包装材料和药品包装制品的研发、制造与销售”经营范围；根据新《公司法》等规定，取消监事会，由董事会审计委员会行使监事会职权。同时修订注册资本为6,637,199,874元，明确H股发行情况（共发行258,197,600股H股，占股本3.89%）。"
恒瑞医药,sh.600276,2025-12-25,恒瑞医药公告，公司及子公司上海恒瑞医药有限公司的注射用SHR-A1904于近日被国家药品监督管理局药品审评中心纳入突破性治疗品种名单。
恒瑞医药,sh.600276,2025-12-25,恒瑞医药于2025年12月25日发生一笔大宗交易，成交金额2271.80万元。当日收盘价61.40元，上涨0.28%，换手率0.24%，成交额9.52亿元。全天主力资金净流出4190.06万元，近5日该股累计上涨2.33%，近5日资金合计净流出2.53亿元。
