code_name,ticker,created_at,text
恒瑞医药,sh.600276,2026-01-05,原文信息不足，无法形成完整摘要。
恒瑞医药,sh.600276,2026-01-05,"恒瑞医药于2026年1月5日提交的证券变动月报表显示，截至2025年12月31日，公司法定/注册股本总额为6,637,199,874元，其中H股258,197,600股、A股6,379,002,274股，均无变动。本月内已发行股份及库存股份亦无增减。A股员工持股计划本月底可能发行或自库存转让的股份数为3,738,950股。"
恒瑞医药,sh.600276,2026-01-05,恒瑞医药于2026年1月5日发布海外监管公告，称公司已获得药物临床试验批准通知书。该公告依据香港联交所上市规则第13.10B条刊发，内容源自公司在上海证券交易所网站的披露。公司董事会成员包括执行董事孙飘扬、戴洪斌等。
恒瑞医药,sh.600276,2026-01-05,原文信息不足，无法形成完整摘要。
恒瑞医药,sh.600276,2026-01-05,2026年1月5日，脑机接口与CXO板块走强，医疗创新ETF(516820.SH)上涨2.22%。成分股中，神州细胞(688520)上涨6.10%，恒瑞医药(600276)上涨5.59%，药明康德(603259)上涨5.35%，三生国健、康龙化成等个股跟涨。
恒瑞医药,sh.600276,2026-01-05,恒瑞医药（600276.SH）公告称，其子公司福建盛迪医药有限公司收到国家药监局核准签发的《药物临床试验批准通知书》，同意HRS9531注射液与HRS-5817注射液在成人肥胖或超重患者中开展联合治疗的临床试验。
恒瑞医药,sh.600276,2026-01-05,恒瑞医药子公司福建盛迪医药于2026年1月5日收到国家药监局核准签发的《药物临床试验批准通知书》，涉及HRS9531注射液和HRS-5817注射液两个产品，将于近期开展临床试验。
恒瑞医药,sh.600276,2026-01-05,恒瑞医药于2026年1月5日公告，公司及子公司成都盛迪医药、天津恒瑞医药近日收到国家药监局核准签发的关于HRS-4357注射液、HRS-5041片的《药物临床试验批准通知书》，上述产品将于近期开展临床试验。
