code_name,ticker,created_at,text
金山办公,sh.688111,2026-06-05,金山办公于2026年6月5日正式发布AI笔记产品WPS笔记。该产品为面向个人知识管理场景的AI原生多模态笔记，支持语音、图片、文字、网页等多种信息录入方式，并将AI能力贯穿从知识记录到复用的全过程。
金山办公,sh.688111,2026-06-05,金山办公于2026年6月5日发布WPS笔记，这是一款面向个人知识管理场景的AI原生多模态笔记产品，具备录入、理解、组织、检索和复用五项能力，支持语音、图片、文字、网页等多种信息录入方式，覆盖会议、课堂、白板讨论等场景。
金山办公,sh.688111,2026-06-05,金山办公于2026年6月5日在北京“WPS AI Next”活动中发布WPS笔记，该AI笔记产品贯穿记录、整理与复用全过程。
金山办公,sh.688111,2026-06-05,金山办公于2026年6月5日正式发布WPS笔记，AI贯穿记录、整理与复用全过程。WPS笔记研发负责人陈泳豪表示，AI时代知识工作者缺少的是能被理解、被找到、被再次使用的信息。
金山办公,sh.688111,2026-06-05,金山办公正式发布AI原生产品“WPS笔记”。公司持续丰富产品体验和会员权益，以提升AI活跃用户数为核心目标，推动用户及付费用户增长。财报显示，一季度个人业务收入9.75亿元，同比增长13.80%。
