code_name,ticker,created_at,text
金山办公,sh.688111,2026-02-27,融资客看好6只股票，买入金额占成交比例超过30%。涉及股票包括港迪技术（买入占成交比例32.30%）、木林森（31.07%）、中原高速（30.85%）等，金山办公（688111）被提及但未显示具体比例。原文未提供其他明确信息。
金山办公,sh.688111,2026-02-27,原文信息不足，无法形成完整摘要。
金山办公,sh.688111,2026-02-27,金山办公2025年业绩快报显示，全年营业收入59.29亿元，同比增长15.78%；归属于上市公司股东的净利润18.43亿元，同比增长12.03%；基本每股收益3.98元，同比增长11.80%。
金山办公,sh.688111,2026-02-27,金山办公2025年度营业总收入59.29亿元，同比增长15.78%；归属于母公司所有者的净利润18.43亿元，同比增长12.03%。该数据于2026年2月27日公告。
金山办公,sh.688111,2026-02-27,金山办公2025年业绩快报显示，公司实现营业总收入59.29亿元，同比增长15.78%；归母净利润18.43亿元，同比增长12.03%。
金山办公,sh.688111,2026-02-27,金山办公2月27日发布业绩快报，2025年实现营业总收入59.29亿元，同比增长15.78%；归母净利润18.43亿元，同比增长12.03%；基本每股收益3.98元。报告期内各项主营业务收入保持稳健增长。
金山办公,sh.688111,2026-02-27,金山办公2025年度业绩快报显示，公司实现营业收入59.29亿元，同比增长15.78%；归属于母公司所有者净利润18.43亿元，同比增长12.03%。其中，WPS个人业务收入约36.26亿元。公告称各项主营业务收入保持稳健增长。
金山办公,sh.688111,2026-02-27,金山办公2025年度业绩快报显示，公司实现营业收入592874万元，同比增长15.78%；归属于母公司所有者净利润184298万元，同比增长12.03%。
