code_name,ticker,created_at,text
金山办公,sh.688111,2026-01-14,原文信息不足，无法形成完整摘要。
金山办公,sh.688111,2026-01-14,金山办公在2026年1月14日融资余额达316142.00万元，较前一交易日增加27591.51万元，环比增长9.56%，当日股价下跌2.16%。
金山办公,sh.688111,2026-01-14,2026年1月14日，据证券时报网报道，10只科创板股获融资净买入额超1亿元，其中金山办公以2.76亿元净买入额居首。其他融资净买入额居前的股票包括成都先导、中科星图、中芯国际、荣昌生物、西部超导、绿的谐波等。
金山办公,sh.688111,2026-01-14,截至2025年12月31日，上证科创板50成份指数前十大权重股包括中芯国际、寒武纪、海光信息、澜起科技、中微公司、金山办公等，合计占比54.42%。同时，GEO新赛道崛起，AI应用板块持续爆发，科创50ETF涨超3%。
金山办公,sh.688111,2026-01-14,截至2026年1月14日，智谱AI概念板块整体上涨4.21%，主力资金净流入34只个股。其中，奥飞数据、能科科技、深桑达A、法本信息等个股主力资金净流入额分别为13726.19万元、13464.82万元、11130.22万元和10542.22万元。原文未提供金山办公在该概念中的具体表现信息。
金山办公,sh.688111,2026-01-14,云办公概念板块当日上涨4.52%，主力资金净流入27只个股。原文未披露具体个股名单及金山办公的相关数据。
