code_name,ticker,created_at,text
贵州茅台,sh.600519,2025-12-12,截至2025年11月28日，上证180指数前十大权重股包括贵州茅台(600519)、紫金矿业(601899)、恒瑞医药(600276)等。上证180ETF指数基金(530280)当日红盘向上，机构看好春季行情。
贵州茅台,sh.600519,2025-12-12,截至2025年11月28日，A500ETF基金(512050)盘中成交额超80亿元，已连续8天净流入，累计净流入近30亿元。该基金跟踪的中证A500指数前十大权重股包括宁德时代、贵州茅台、中国平安、招商银行、紫金矿业、中际旭创、美的集团、兴业银行等。
贵州茅台,sh.600519,2025-12-12,贵州茅台（600519）飞天茅台批发价首次跌破1499元指导价，这是自2018年将指导价上调至1499元以来的首次。此前飞天茅台长期保持高溢价，2021年市场价一度超过3500元。
贵州茅台,sh.600519,2025-12-12,截至2025年12月12日，百元股数量达167只，较上一日增加9只。贵州茅台收盘价1420.65元，涨0.61%；寒武纪收盘价1344.00元，跌2.75%；摩尔线程收盘价814.88元，跌13.41%。
贵州茅台,sh.600519,2025-12-12,段永平复盘其重仓股贵州茅台、腾讯及苹果，并赞赏其商业模式。同时，深陷亏损的众泰汽车悄然进行高管换血。
贵州茅台,sh.600519,2025-12-12,根据2025年12月12日财中社报道，云南民宿集体维权，携程深陷反垄断争议。携程2025年三季报显示，净营收达183亿元，归母净利润同比飙升192.6%至199亿元，超过同期贵州茅台（600519.SH）。报道指出，携程市占率超过七成，平台被指成为“拿捏”和“惩罚”商家的工具。
