code_name,ticker,created_at,text
贵州茅台,sh.600519,2025-12-28,根据2025年12月28日第一财经报道，贵州茅台（600519.SH）在2025年年内收跌，属于万亿市值股票中少数下跌的个股。近两年累计下跌近12%，总市值从年初约2.17万亿元缩水至年底1.77万亿元。
贵州茅台,sh.600519,2025-12-28,贵州茅台曾于十年前通过“999打款配819”等灵活政策稳定渠道。近年来，茅台通过多种手段减少经销商数量并降低配额，目前经销商直接销量占比约为30%。
贵州茅台,sh.600519,2025-12-28,12月28日，贵州茅台在2025年度全国经销商联谊会上表示，将尽最大努力防止价格炒作，推进营销市场化转型。茅台集团董事长陈华指出，价格市场化改革的目的是尊重市场经济规律和消费者选择，让产品价格随行就市，合理稳预期。
贵州茅台,sh.600519,2025-12-28,2025年12月28日，贵州茅台董事长陈华表示，将尽最大努力防止价格炒作。他指出，价格市场化改革旨在尊重市场经济规律和消费者选择，让产品价格随行就市，根据市场供需实际促进量价平衡。价格过高或过低均易引起市场波动。
贵州茅台,sh.600519,2025-12-28,原文信息不足，无法形成完整摘要。
贵州茅台,sh.600519,2025-12-28,贵州茅台在2026年全国经销商联谊会上表示，明年将更聚焦家庭和友情消费，并积极主动寻找和拓展新的客群。
