code_name,ticker,created_at,text
贵州茅台,sh.600519,2026-03-03,截至2026年3月3日，证券时报网报道，连续5日主力资金净流出的股票共有829只。其中，兆易创新连续5日净流出57.39亿元，净流出比例15.32%，累计下跌15.53%；三花智控连续6日净流出53.09亿元，比例14.10%，累计下跌12.90%；天孚通信连续5日净流出47.10亿元，比例6.16%，累计下跌4.69%。原文未提供贵州茅台具体数据。
贵州茅台,sh.600519,2026-03-03,贵州茅台公告称，截至2026年2月，公司已累计回购股份57.25万股，支付总金额8.01亿元。其中2026年2月单月回购15.57万股，占公司总股本0.0124%，回购价格区间为1456.12元至1499.74元/股，当月支付金额为2.3亿元。
贵州茅台,sh.600519,2026-03-03,"贵州茅台（600519.SH）公告，2026年2月累计回购股份155,650股，占总股本0.0124%，回购价格区间为1,456.12元/股至1,499.74元/股，支付金额约2.3亿元。截至2026年2月底，公司已累计回购股份57.25万股，支付总金额8.01亿元。"
贵州茅台,sh.600519,2026-03-03,"截至2026年2月底，贵州茅台累计回购股份57.25万股（572,503股），占总股本0.0457%，支付总金额8.01亿元（不含交易费用），购买价格区间为每股1,322.60元至1,499.74元。"
贵州茅台,sh.600519,2026-03-03,截至2026年2月底，贵州茅台（600519）已回购57万股，占总股本0.0457%，累计回购金额8.01亿元，回购价格区间为1322.6元/股至1499.74元/股。
贵州茅台,sh.600519,2026-03-03,贵州茅台(600519)于2026年3月3日公告，2026年2月累计回购股份15.57万股，占总股本0.0124%，购买最高价1499.74元/股、最低价1456.12元/股，支付金额2.3亿元。截至公告日，公司已累计回购股份57.25万股，支付总金额8.01亿元。
贵州茅台,sh.600519,2026-03-03,"贵州茅台于2026年3月3日公告，截至2月底，公司已累计回购股份57.25万股，支付总金额8.01亿元。其中，2月份回购155,650股，占总股本0.0124%，购买价格区间为每股1,456.12元至1,499.74元，支付金额约2.30亿元。"
贵州茅台,sh.600519,2026-03-03,"贵州茅台于2026年2月累计回购股份155,650股，占公司总股本的比例为0.0124%。"
贵州茅台,sh.600519,2026-03-03,贵州茅台（600519.SH）公告，截至2026年2月，公司累计回购股份57.25万股，支付总金额8.01亿元。其中2026年2月回购15.57万股，占总股本0.0124%，回购价格区间为1456.12元/股至1499.74元/股。
