code_name,ticker,created_at,text
贵州茅台,sh.600519,2026-03-04,原文信息不足，无法形成完整摘要。
贵州茅台,sh.600519,2026-03-04,贵州茅台3月3日公告，截至2026年2月底，公司累计回购股份57.25万股，支付总金额8.01亿元。其中，2月回购15.57万股，占公司总股本0.0124%，购买价格区间为1456.12元/股至1499.74元/股，支付金额2.3亿元。
贵州茅台,sh.600519,2026-03-04,2026年3月3日晚间，贵州茅台（600519.SH）发布回购进展公告，2026年2月累计回购股份15.57万股，占总股本0.0124%，购买价格区间为1456.12元/股至1499.74元/股，支付金额2.3亿元。
贵州茅台,sh.600519,2026-03-04,原文信息不足，无法形成完整摘要。
贵州茅台,sh.600519,2026-03-04,贵州茅台于2026年3月3日发布公告，披露2026年2月股份回购进展。当月公司累计回购15.57万股，占总股本0.0124%，最高价1499.74元/股，最低价1456.12元/股，支付金额约2.3亿元。截至目前，公司已累计回购金额超8亿元。
贵州茅台,sh.600519,2026-03-04,截至2026年3月4日，中国石油市值突破2.14万亿元，时隔七年重夺A股市值冠军。此外，工商银行、建设银行、中国移动、贵州茅台、中国银行等公司市值均超万亿元。
贵州茅台,sh.600519,2026-03-04,原文信息不足，无法形成完整摘要。
贵州茅台,sh.600519,2026-03-04,原文信息不足，无法形成完整摘要。
贵州茅台,sh.600519,2026-03-04,时隔七年，中国石油重返A股市值第一。自2019年以来，A股市值冠军主要在工商银行、贵州茅台之间争夺。2025年8月6日，农业银行首次夺得A股市值冠军，并保持136个交易日。受近日中东局势影响，市场持续计价地缘风险溢价，推动国际油价走高。
