code_name,ticker,created_at,text
贵州茅台,sh.600519,2026-01-14,2026年1月13日，贵州茅台董事会以通讯表决方式全票通过《2026年贵州茅台酒市场化运营方案》。方案明确回归“金字塔”型产品结构：塔基为飞天53%vol 500ml等规格，塔腰为精品、生肖茅台酒，塔尖为陈年及文化系列。运营模式从“自售+经销”转向“自售+经销+代售+寄售”多维协同。渠道布局构建批发、线下零售、线上零售、餐饮、私域五大渠道。价格机制采取“随行就市、相对平稳”的动态调整，并公布自营体系零售价，如飞天53%vol 500ml 2026年1499元/瓶。
贵州茅台,sh.600519,2026-01-14,贵州茅台于1月13日晚发布董事会决议，审议通过《2026年贵州茅台酒市场化运营方案》，该方案涉及产品体系、运营模式、渠道布局、价格机制四个方面的调整。
贵州茅台,sh.600519,2026-01-14,贵州茅台酒股份有限公司于2026年开年以来，切实推进营销体系市场化转型，该转型进程已按下“加速键”。
贵州茅台,sh.600519,2026-01-14,贵州茅台于2026年1月13日发布第四届董事会2026年度第一次会议决议公告，同意《2026年贵州茅台酒市场化运营方案》。
贵州茅台,sh.600519,2026-01-14,贵州茅台于2026年1月13日公告，公司董事会审议通过《2026年贵州茅台酒市场化运营方案》，方案提出构建“随行就市、相对平稳”的自营体系零售价格动态调整机制，以市场为导向。
贵州茅台,sh.600519,2026-01-14,截至2026年1月14日，深沪北百元股排行榜显示，寒武纪最新收盘价1439.12元，涨幅2.20%，属电子行业；贵州茅台收盘价1398.01元，跌幅0.92%，属食品饮料行业；源杰科技收盘价704.00元，涨幅5.29%，均来自市场公开数据。
贵州茅台,sh.600519,2026-01-14,河南老厂金星啤酒押中“中式精酿”风口，年赚超3亿，计划赴港股上市。贵州茅台（600519.SH）、五粮液（000858.SZ）等白酒巨头在稳固高端市场的同时，也布局年轻化、低度化产品以拓展消费场景。金星啤酒的翻红被视为区域品牌在成熟工业体系基础上，踩中行业风口，于存量市场中切出新增量的典型案例。
贵州茅台,sh.600519,2026-01-14,2026年1月14日，白酒板块收盘报2237.49点，微跌0.03%，其中16只白酒股下跌。贵州茅台收盘价1398.01元/股，下跌0.92%，跌破1400元/股；五粮液收盘107.04元/股，下跌0.89%；山西汾酒收盘175.48元/股，下跌0.85%；泸州老窖收盘116.86元/股。
贵州茅台,sh.600519,2026-01-14,贵州茅台董事会于2026年1月14日同意《2026年贵州茅台酒市场化运营方案》，方案明确了产品体系、运营模式、渠道布局及价格机制四方面内容。
