code_name,ticker,created_at,text
贵州茅台,sh.600519,2026-01-06,2026年1月5日，贵州茅台在2026年度东方传统色发布活动现场正式亮相茅台酒（丙午马年）生肖系列产品，该系列全线主色调采用年度色“齐紫”。
贵州茅台,sh.600519,2026-01-06,贵州茅台于2026年1月5日发布贵州茅台酒（丙午马年）；同时，针对“1169元飞天直采”传闻，贵州茅台已进行辟谣。
贵州茅台,sh.600519,2026-01-06,截至2025年12月31日，中证A500指数前十大权重股包括宁德时代、贵州茅台、中国平安等。2026年1月6日，上证指数创十年来新高，A500ETF基金（512050）涨超1.3%，盘中成交额超106亿元。
贵州茅台,sh.600519,2026-01-06,马年生肖茅台上市首日被热炒，2499元珍享版市场价涨至6899元。贵州茅台（600519.SH）1月5日开盘上涨，结束多日下跌。截至2026年1月6日收盘，报收1428.01元/股，收涨0.14%，总市值1.79万亿元。
贵州茅台,sh.600519,2026-01-06,截至2026年1月6日，深沪北百元股数量达202只，电子行业占比最高。贵州茅台收盘价1428.01元，当日上涨0.14%，所属食品饮料行业；寒武纪收盘价1383.10元，下跌0.50%，所属电子行业；源杰科技收盘价646.00元，下跌2.71%。
贵州茅台,sh.600519,2026-01-06,贵州茅台将“以消费者为中心、推进市场化转型”作为2026年市场营销工作首要任务，并认为i茅台是其渠道变革的重要利器。该公司产品通过直销和批发代理渠道进行销售。
