code_name,ticker,created_at,text
贵州茅台,sh.600519,2026-05-29,贵州茅台于2026年5月27日公告完成30亿元股份回购，实际回购218.86万股，占总股本0.17%，回购价格区间为1252.63元至1499.74元，均价1370.70元。此外，段永平向江西安福县慈善会捐赠1万股贵州茅台股票。
贵州茅台,sh.600519,2026-05-29,段永平于2026年5月26日向安福县慈善会无偿捐赠所持贵州茅台股票1万股，专项用于支持安福教育事业发展。该捐赠通过“安福县段永平教育专项基金”实施，相关信息由安福县委县政府官方公众号发布。
贵州茅台,sh.600519,2026-05-29,段永平于2026年5月29日捐赠1万股贵州茅台股票，按当日盘中价格计算，该笔捐赠价值超过1300万元。
贵州茅台,sh.600519,2026-05-29,原文信息不足，无法形成完整摘要。
贵州茅台,sh.600519,2026-05-29,根据证券时报网2026年5月29日报道，超级品牌概念当日上涨1.64%，主力资金净流入27只股票。其中，贵州茅台（600519）上涨3.92%，换手率0.61%，主力资金净流入85165.92万元，净流入比率为8.48%。
贵州茅台,sh.600519,2026-05-29,白酒概念板块上涨1.48%，主力资金净流入。个股方面，贵州茅台上涨3.92%，主力资金净流入85165.92万元，净流入比率8.48%；五粮液上涨4.17%，主力资金净流入48553.45万元，净流入比率9.66%；酒鬼酒上涨10.00%。
贵州茅台,sh.600519,2026-05-29,2026年5月29日，食品饮料行业主力资金流向数据显示，贵州茅台主力资金净流入85165.92万元，当日涨幅3.92%；五粮液净流入48553.45万元，涨幅4.17%；酒鬼酒净流入40197.98万元，涨幅10.00%。该信息来源于证券时报网资金流向日报。
