code_name,ticker,created_at,text
海天味业,sh.603288,2025-12-19,原文信息不足，无法形成完整摘要。
海天味业,sh.603288,2025-12-19,海天味业于2025年12月19日发布公告，公布了未来三年（2025-2027年）股东回报规划，并提出了贯彻落实“提质增效重回报”行动方案。
海天味业,sh.603288,2025-12-19,原文信息不足，无法形成完整摘要。
海天味业,sh.603288,2025-12-19,海天味业于2025年12月19日发布董事和高级管理人员薪酬管理制度。该制度明确了适用对象（全体董事及高级管理人员），薪酬构成包括基本薪酬、绩效薪酬（占比不低于50%）、中长期激励等，独立董事薪酬为固定津贴。制度还规定了薪酬调整、追索扣回机制及决策程序。
海天味业,sh.603288,2025-12-19,海天味业（证券代码：603288）于2025年12月19日公告，拟实施特别分红，每10股派发现金红利3元，总额超17亿元。同时，公司承诺未来三年分红比例不低于80%。
海天味业,sh.603288,2025-12-19,海天味业（603288）发布未来三年（2025-2027年）股东回报规划，计划每年度现金分红比例不低于当年净利润的80%，该规划待股东会审议。同时公布2025年特别分红预案，拟每10股派发现金红利3.0元（含税）。
海天味业,sh.603288,2025-12-19,海天味业于2025年12月18日晚间公告2025年回报股东特别分红预案，拟每10股派发现金红利3.0元（含税），合计派发现金红利约17.54亿元（含税）。
海天味业,sh.603288,2025-12-19,今年以来，上市公司现金分红总额达2.61万亿元，再创历史新高。同时，海天味业发布了未来三年（2025-2027年）股东回报规划。
海天味业,sh.603288,2025-12-19,海天味业于2025年12月18日披露特别分红预案与未来三年股东回报规划，以高比例分红方案引发市场关注。
