code_name,ticker,created_at,text
海天味业,sh.603288,2026-03-13,原文信息不足，无法形成完整摘要。
海天味业,sh.603288,2026-03-13,截至2026年2月27日，中证全指食品指数前十大权重股包括海天味业、伊利股份等，合计占比48.72%。当日食品ETF鹏华(560130)涨超1.3%，消费板块表现活跃。
海天味业,sh.603288,2026-03-13,2026年3月13日，因楼市出现“小阳春”及春游高峰临近，大消费板块低位活跃。重庆啤酒、海天味业、中炬高新、天味食品等个股股价涨超2%。消息显示，3月9日至11日，北京二手住宅单日成交分别达712套、657套、751套，持续高位运行。房地产市场的阶段回暖被认为有助于改善居民收入预期，进而间接促进消费意愿提升。
海天味业,sh.603288,2026-03-13,据证券时报网2026年3月13日报道，131只股票中线走稳，站上半年线。相关个股包括天振股份、北辰实业、*ST双成及海天味业（603288）等，但未提供具体财务数据或业务影响。
海天味业,sh.603288,2026-03-13,A股午后单边下行，跌幅扩大，化工、核电、风电、锂电池板块逆市走强，银行股走强，计算机板块走弱。食品饮料板块领涨，其中三元股份涨超4%，重庆啤酒、皇台酒业、泸州老窖、惠泉啤酒、海天味业等涨超2%。
