code_name,ticker,created_at,text
海天味业,sh.603288,2026-04-27,海天味业发布2026年第一季度报告。报告显示，2026年一季度公司实现营业收入90.29亿元，同比增长8.57%；利润总额28.86亿元，同比增长10.40%；归母净利润24.44亿元，同比增长10.97%；基本每股收益0.42元，同比增长5.00%。报告期末总资产483.79亿元，较上年度末下降7.29%；归
海天味业,sh.603288,2026-04-27,海天味业发布2026年第一季度未经审计经营数据：主营业务收入86.47亿元，同比增长8.34%。分产品看，酱油收入47.51亿元（+7.48%），蚝油14.22亿元（+4.60%），调味酱9.23亿元（+1.12%），其他15.51亿元（+20.32%）。线下渠道收入81
海天味业,sh.603288,2026-04-27,原文信息不足，无法形成完整摘要。
海天味业,sh.603288,2026-04-27,海天味业于2026年4月27日发布海外监管公告，公布其2026年度“提质增效重回报”行动方案。该公告依据《香港联合交易所有限公司证券上市规则》第13.10B条作出，并已刊登于上海证券交易所网站。公告同时列出了公司董事会成员名单。
海天味业,sh.603288,2026-04-27,海天味业（603288.SH）2026年第一季度实现营业收入90.29亿元，同比增长8.57%；归属于上市公司股东的净利润为24.44亿元，同比增长10.97%，环比增长42%。
海天味业,sh.603288,2026-04-27,海天味业2026年第一季度实现营业收入90.29亿元，同比增长8.57%；归母净利润24.44亿元，同比增长10.97%；基本每股收益0.42元。
海天味业,sh.603288,2026-04-27,海天味业2026年第一季度实现营业收入90.29亿元，同比增长8.57%；归属于上市公司股东的净利润24.44亿元，同比增长10.97%；基本每股收益0.42元。经营活动产生的现金流量净额为-4.67亿元。
海天味业,sh.603288,2026-04-27,海天味业（603288.SH）发布2026年第一季度业绩公告，公司营收约90.29亿元，同比增长8.57%；归属于上市公司股东的净利润约24.44亿元，同比增长10.97%；基本每股收益0.42元，同比增长5%。
海天味业,sh.603288,2026-04-27,海天味业（603288）发布2026年一季报，一季度营业收入90.3亿元，同比上升8.6%；归母净利润24.4亿元，同比上升11.0%；扣非归母净利润23.5亿元，同比上升9.3%；经营现金流净额为-4.67亿元，同比下降2.1%；每股收益0.4176元。
