code_name,ticker,created_at,text
交通银行,sh.601328,2025-12-15,交通银行发布公告，业务总监（公司与机构业务）唐朔因工作调动辞任，自2025年12月15日起生效。唐朔确认与董事会及高管层无意见分歧，亦无需通知股东及债权人事项。唐朔在交通银行服务24年，曾任北京市、广东省、江西省分行行长等职。
交通银行,sh.601328,2025-12-15,交通银行12月15日公告，唐朔因工作调动原因，辞去公司业务总监（公司与机构业务）职务，辞任自2025年12月15日起生效。
交通银行,sh.601328,2025-12-15,交通银行（601328.SH）于2025年12月15日公告，高管唐朔因工作调动原因，辞去业务总监（公司与机构业务）职务，辞任自当日起生效。
交通银行,sh.601328,2025-12-15,交通银行（601328/03328）公告，业务总监（公司与机构业务）唐朔因工作调动辞任，辞任自2025年12月15日起生效。
交通银行,sh.601328,2025-12-15,交通银行业务总监唐朔因工作调动辞职。唐朔于2001年加入交通银行，连续服务24年，曾担任北京市分行行长、广东省分行行长、江西省分行行长及副行长（代为履行行长职责）、北京市分行副行长、行长助理，总行公司机构业务部（投资银行部）副总经理等职务。
交通银行,sh.601328,2025-12-15,12月15日，交通银行公告称，唐朔因工作调动辞去该行业务总监（公司与机构业务）职务，同日履新建设银行党委委员。
交通银行,sh.601328,2025-12-15,交通银行于2025年12月15日发生一笔大宗交易，成交68.00万股，成交额498.44万元。当日收盘价7.33元，下跌0.27%，换手率0.38%，成交额7.29亿元，全天主力资金净流入5224.45万元。近5日该股累计下跌1.74%，近5日资金合计净流入1.42亿元。
交通银行,sh.601328,2025-12-15,交通银行公告称，将每股派发现金股息0.1563元（含税），A股派息日预计为2025年12月25日，共分配现金股利138.11亿元。六大行合计已实施或拟实施现金分红超2000亿元。
