code_name,ticker,created_at,text
交通银行,sh.601328,2026-04-01,"交通银行于2026年4月1日提交截至3月31日的证券变动月报表。数据显示，其H股（35,011,862,630股）、A股（53,351,921,593股）及境内优先股（450,000,000股）的法定/注册股本与已发行股份数均较上月底无变动。本月底法定/注册股本总额为人民币133,363,784,223元。月报表确认H股已符合适用的公众持股量要求，本月内无股份期权、权证或其他股份变动。"
交通银行,sh.601328,2026-04-01,交通银行于2026年4月1日发布更新公告，建议派发截至2025年12月31日止年度末期股息，普通股息每10股1.684元人民币。该方案需经股东于2026年6月26日批准。除净日为2026年7月2日，暂停办理股份过户登记日期为2026年7月4日至7月9日，股息派发日定于2026年8月14日。具体派息金额及汇率有待
交通银行,sh.601328,2026-04-01,"交通银行发布2025年度可持续发展报告，截至报告期末，该行人民银行口径绿色贷款余额达9,508.25亿元。报告显示，交通银行在绿色金融领域丰富产品谱系、完善组织架构，协同推进转型金融，并深度融入国家战略，全方位加强金融服务，支持实体经济提质增效。"
交通银行,sh.601328,2026-04-01,截至2025年末，交通银行集团资产总额突破15.5万亿元，较上年末增长4.35%，实现规模效益双提升。同时，该行分红率连续第14年保持在30%以上。
交通银行,sh.601328,2026-04-01,截至2025年末，六大国有行个人贷款不良率数据披露，其中工商银行和交通银行个人贷款不良率最高，均为1.58%；中国银行个人贷款不良率最低，为1.10%。从同比变化看，交通银行个人贷款不良率上升0.5个百分点，工商银行上升0.43个百分点。
交通银行,sh.601328,2026-04-01,交通银行2025年实现规模效益双提升，截至年末集团资产总额突破15.5万亿元，较上年末增长4.35%；分红率连续14年保持在30%以上。
交通银行,sh.601328,2026-04-01,截至2025年末，六大行（工商银行、农业银行、中国银行、建设银行、交通银行、邮储银行）公布期末分红方案，同时披露资产质量数据。其中，交通银行不良贷款率为1.28%，较上年末下降。工商银行、农业银行、中国银行、建设银行不良贷款率分别下降0.03、0.03、0.02、0.03个百分点。邮储银行不良贷款率为0.95%。原文未明确分红总金额具体细节。
