code_name,ticker,created_at,text
交通银行,sh.601328,2026-05-16,交通银行于2026年5月15日在全国银行间债券市场成功发行2026年第一期总损失吸收能力非资本债券（债券通），发行规模500亿元，票面利率1.75%，为4年期固定利率债券，在第3年末附有条件发行人赎回权。募集资金扣除发行费用后，将用于提升本行总损失吸收能力。
交通银行,sh.601328,2026-05-16,原文信息不足，无法形成完整摘要。
交通银行,sh.601328,2026-05-16,根据上海证券报2026年5月16日报道，自2020年9月起，工商银行、建设银行、农业银行、中国银行、交通银行5大国有行旗下理财子公司陆续与外资巨头成立合资理财公司。目前5家合资理财公司合计管理规模已逼近3000亿元，但整体规模仍较小，且面临盈利难题。
交通银行,sh.601328,2026-05-16,十余家金融租赁公司进军商业航天领域，卫星融资租赁业务逐渐兴起。交银金租相关负责人表示，公司依托母公司全牌照优势，联动交通银行北京市分行，为卫星项目提供覆盖全生命周期的综合金融服务，以缓解行业前期投入大、资金周转周期长的融资痛点。
交通银行,sh.601328,2026-05-16,险资2026年一季度持仓显示，银行股整体持仓稳定，但存在调仓动作：交通银行、齐鲁银行、邮储银行等被减持，而常熟银行、南京银行、苏州银行等获加仓。截至一季度，42家上市银行近12个月平均股息率超4%，市净率普遍低于0.6倍。
