code_name,ticker,created_at,text
交通银行,sh.601328,2026-05-06,"交通银行于2026年5月6日提交截至2026年4月30日的证券变动月报表。报告显示，该行H股、A股及境内优先股的法定/注册股本及已发行股份数目均无变动。H股法定/注册股本为35,011,862,630元，A股为53,351,921,593元，境内优先股为45,000,000,000元，总股本合计133,363,784,223元。H股公众持股量符合香港联交所要求。"
交通银行,sh.601328,2026-05-06,2026年一季度，上市银行存款合计增加10.31万亿元，部分区域性银行增速较快。其中，工商银行存款规模居首，为38.14万亿元；农业银行、建设银行分别达34.08万亿元、32.04万亿元；中国银行、邮储银行、交通银行存款规模分别为27.17万亿元、17.29万亿元、9.69万亿元。
交通银行,sh.601328,2026-05-06,交通银行于近期完成对新疆石河子交银村镇银行的收购改建，该行成为其旗下4家村镇银行中最后一家被收购的银行，标志着交通银行已“清空”全部村镇银行。此前，年内已有70余家村镇银行“退场”，村镇银行整合重组进入快车道。
交通银行,sh.601328,2026-05-06,交通银行等多家银行已披露养老金托管规模。其中，工商银行达3.8万亿元，交通银行达3.4万亿元，建设银行和农业银行均超2万亿元，中国银行和招商银行均超1万亿元。多数国有大行和股份行实现同比两位数增长。此外，部分银行还披露了养老金受托管理规模。
交通银行,sh.601328,2026-05-06,交银信托党委书记、董事长张文因涉嫌严重违纪违法，正接受中央纪委国家监委驻交通银行纪检监察组纪律审查和上海市监委监察调查。目前，夏华龙代为履行交银信托董事长职责。此外，交银信托总裁任职已于上月获监管批准。
交通银行,sh.601328,2026-05-06,2026年4月，银行“二永债”集中放量，二季度或迎供给高峰。其中兴业银行与光大银行分别发行200亿元和150亿元永续债，交通银行发行300亿元二级资本债券。国有行利率普遍低于股份制银行，但整体利率水平处于历史低位。
交通银行,sh.601328,2026-05-06,根据证券时报网2026年5月6日报道，银行行业资金流出榜显示，招商银行、工商银行、兴业银行、浦发银行等5只股票主力资金净流出均超5000万元，其中招商银行净流出约7.91亿元，工商银行净流出约3.38亿元，兴业银行净流出约3.24亿元，浦发银行净流出约1.27亿元。
交通银行,sh.601328,2026-05-06,交通银行2026年一季报显示，该行活期存款占比30.29%，较上年末下降0.54个百分点。在定存到期潮背景下，一季度上市银行存款少增万亿元，多家银行付息率下降。
交通银行,sh.601328,2026-05-06,交通银行2026年一季度净息差为1.23%，与上年同期持平；贵阳银行同期净息差为1.66%，同比回升12个基点。分析指出，一季度商业银行净息差企稳主要来自负债端贡献。
