code_name,ticker,created_at,text
海尔智家,sh.600690,2025-12-18,原文信息不足，无法形成完整摘要。
海尔智家,sh.600690,2025-12-18,"海尔智家于2025年12月18日披露，当日以人民币27.22至27.43元/股的价格，通过上海证券交易所购回70,000股A股，总金额约191.25万元。该购回股份用于股权激励计划，将持作库存股份；购回后，公司已发行股份（不含库存）为6,184,213,125股。"
海尔智家,sh.600690,2025-12-18,海尔智家12月17日在互动平台表示，公司股价短期波动受宏观经济环境、行业周期、市场情绪及资金偏好等多重复杂因素共同影响。公司运营稳健，体现了战略有效性及主营业务韧性。
海尔智家,sh.600690,2025-12-18,海尔智家于2025年12月18日在互动平台表示，公司与苏宁存在多种合作模式，其中账单模式实行每周滚动性支付结算；部分新零售场景则在送货到达用户处时由系统自动结算。
海尔智家,sh.600690,2025-12-18,2025年12月18日，海尔智家在互动平台回应投资者称，公司将充分保障应收款回收的确定性，且相关应收款设有抵押物。
海尔智家,sh.600690,2025-12-18,海尔智家于2025年12月18日在互动平台回应投资者提问时表示，公司通过外部信用保险、不动产抵押、银行共管账户等多类型保障方式及业务模式，确保货款顺利回收。
