code_name,ticker,created_at,text
海尔智家,sh.600690,2026-06-02,原文信息不足，无法形成完整摘要。
海尔智家,sh.600690,2026-06-02,"海尔智家于2026年6月2日披露报表，当日通过上海证券交易所购回A股1,470,000股，回购价格区间为每股20.92元至21.12元，总金额30,911,490.15元。此次购回股份将持作库存股份，用于股权激励计划。购回后，已发行股份（不含库存）由6,126,144,425股减少至6,124,674,425股，库存股份增至128,353,986股。"
海尔智家,sh.600690,2026-06-02,截至2026年6月2日，A股共有93家公司披露回购进展。其中，海尔智家已实施回购金额10.45亿元，位居回购金额前列。
海尔智家,sh.600690,2026-06-02,美的集团在过去两个月内累计斥资34.22亿元进行股票回购。同时，海尔智家、石头科技等家电企业也在推进各自的股票回购方案实施。
海尔智家,sh.600690,2026-06-02,青岛银行股东海尔产业发展拟通过大宗交易方式减持约1.07亿股股份。截至公告日，海尔集团公司通过旗下多家企业合计持有青岛银行约10.56亿股，占总股本的18.14%。
海尔智家,sh.600690,2026-06-02,海尔产业发展拟减持青岛银行不超过1.84%股份，原因为优化资产结构、聚焦主业。目前，青岛海尔空调电子有限公司、海尔智家股份有限公司分别持有青岛银行4.88%、3.25%股份，均位列该行前十大普通股股东。青岛银行表示，本次减持不会导致该行控制权发生变更。
海尔智家,sh.600690,2026-06-02,海尔智家旗下海尔产业发展计划减持青岛银行1.07亿股股份。截至公告日，海尔集团通过多家子公司合计持有青岛银行约10.56亿股，占其总股本的18.14%。
