code_name,ticker,created_at,text
海尔智家,sh.600690,2026-01-21,海尔智家于2026年1月21日发布提示性公告，计划回购其境外上市外资股（D股）。公告未披露具体回购数量、金额及期限等细节。
海尔智家,sh.600690,2026-01-21,"海尔智家于2026年1月21日在上海证券交易所购回340,000股A股，每股购回价介于人民币25.87元至26.22元，总付出8,838,396元。此次购回的股份将持作库存股份，用于股权激励计划。购回后，公司已发行股份（不含库存）为6,181,580,925股，库存股份增加至71,447,486股。购回授权决议于2025年5月7日通过。"
海尔智家,sh.600690,2026-01-21,海尔智家于2026年1月20日晚公告，拟以不超过200万欧元（不含费用）回购境外上市外资股（D股），回购股份数量上限为100万股，本次回购的股份将予以注销，以减少公司注册资本。
海尔智家,sh.600690,2026-01-21,国投瑞银盛煊混合A在2025年第四季度实现利润129.85万元，净值增长率为1.55%。截至四季度末，基金十大重仓股包括宝丰能源、亨通光电、中信博、海尔智家、河钢股份、赛轮轮胎、中国平安、三一重工、宝武镁业、潍柴动力。
海尔智家,sh.600690,2026-01-21,国投瑞银美丽中国混合A在2025年第四季度实现利润227.64万元，净值增长率0.77%。截至四季度末，该基金十大重仓股包括亨通光电、赛轮轮胎、宝丰能源、河钢股份、中信博、三一重工、中国平安、海兴电力、海尔智家、江山股份。
