code_name,ticker,created_at,text
海尔智家,sh.600690,2026-01-07,"海尔智家于2026年1月7日通过上海证券交易所购回100,000股A股，每股购回价区间为26.16元至26.29元，总金额约262.43万元。该批股份拟持作库存股份，用于股权激励计划。购回后，公司已发行股份（不含库存）减少至6,183,136,925股，库存股份增加至69,891,486股。公司确认本次购回已获授权并符合相关上市规则。"
海尔智家,sh.600690,2026-01-07,108只股票连续5日或5日以上获融资净买入，其中招商蛇口、恒立液压、海尔智家均连续10个交易日获净买入，其他连续获融资净买入天数较多的股票包括九丰能源、易点天下、上大股份、中天科技、中航高科、航天电器、夏厦精密、金枫酒业等。
海尔智家,sh.600690,2026-01-07,根据2026年1月7日上观新闻报道，海尔智家参与上海“国补”活动，与政策、渠道形成“三重福利闭环”，为消费者提供空调等家电的折上折优惠。本轮补贴覆盖冰箱、洗衣机、空调、电视等多类产品，重点鼓励高能效、智能化绿色家电消费。
海尔智家,sh.600690,2026-01-07,根据香港交易所披露，贝莱德在2026年1月2日加仓了海尔智家、药明生物、美的集团、中国银行等港股股票。
海尔智家,sh.600690,2026-01-07,2026年上海家电国补首单落地苏宁易购，海尔智家上海营销部长刘杨为首位顾客送上贺礼，标志着新一轮绿色智能家电推广与消费升级行动启动。本轮以旧换新补贴覆盖冰箱、洗衣机、空调、电视等多品类，重点鼓励高能效、智能化绿色家电消费。
