code_name,ticker,created_at,text
海尔智家,sh.600690,2026-03-28,海尔智家于2026年3月28日发布公告，通过集中竞价交易方式首次回购公司A股股份。
海尔智家,sh.600690,2026-03-28,海尔智家股份有限公司及子公司拟开展铜的大宗原材料套期保值业务，合约价值不超过56.3亿元，资金为自有，有效期自董事会审议通过起12个月。交易仅限铜商品，不进行投机。目的是减少铜价波动对产品成本的影响，保证成本相对稳定。公司已制定风险控制措施，相关业务可行性已获分析确认。
海尔智家,sh.600690,2026-03-28,海尔智家因海外业务扩大导致汇率风险增加，拟开展外汇衍生品交易以套期保值，规避汇率及利率波动影响。交易品种包括外汇远期、掉期、NDF、期权及货币利率互换等，2026年操作余额不超过65亿美元，合约期限一般一年以内，部分业务一至五年。资金来源为自有资金，交易对手为银行等金融机构。公司已建立风险管理和内控制度，该业务具有可行性。
海尔智家,sh.600690,2026-03-28,海尔智家于2026年3月26日发布公告，拟以30亿元至60亿元回购A股股份，回购价格不超过35元/股。该公司是月内195家实施回购的A股上市公司之一。
海尔智家,sh.600690,2026-03-28,截至2026年3月28日，A股市场共有16家公司披露回购进展。其中，海尔智家、长虹美菱、艾德生物的回购实施金额位居前列，分别回购1.68亿元、1.39亿元和8653.06万元。
