code_name,ticker,created_at,text
海光信息,sh.688041,2026-04-10,4月10日，科创板主力资金净流出6.54亿元。其中，源杰科技净流入32286.63万元，涨幅6.93%；芯原股份净流入26739.73万元，涨幅5.26%；聚和材料净流入20086.10万元，涨幅14.69%；普冉股份净流入15075.31万元，涨幅8.78%。
海光信息,sh.688041,2026-04-10,海光信息于2026年4月10日发生一笔大宗交易，成交119万股，成交额2.63亿元，占当日总成交额的3.69%。成交价为221.39元，较当日收盘价231.82元折价4.5%。
海光信息,sh.688041,2026-04-10,海光信息（688041）于2026年4月10日发生8笔大宗交易，合计成交119万股，成交额26345.41万元，成交价221.39元，较当日收盘价231.82元折价4.50%。
海光信息,sh.688041,2026-04-10,海光信息在4月10日发生8笔大宗交易，成交119.00万股，平均成交价221.39元，相对收盘价折价4.50%，成交金额26345.41万元。当日共有4只科创板股大宗交易成交额超过5000万元。
海光信息,sh.688041,2026-04-10,海光信息于2026年4月10日出现8笔大宗交易，总成交金额为2.63亿元。该公司成立于2014年10月24日，注册资本232433.8091万人民币。
