code_name,ticker,created_at,text
海光信息,sh.688041,2026-04-03,海光信息于2026年4月2日发生一笔大宗交易，成交数量20万股，平均成交价格213.68元，相对收盘价溢价0.32%，交易金额4273.60万元。
海光信息,sh.688041,2026-04-03,原文信息不足，无法形成完整摘要。
海光信息,sh.688041,2026-04-03,海光信息于2026年4月3日发生一笔大宗交易，成交20.00万股，成交额4273.60万元。该公司成立于2014年10月24日，注册资本为232433.8091万人民币。
海光信息,sh.688041,2026-04-03,海光信息在2026年春季技术沟通会上公开基于“内生安全”理念的新技术和成果，并首发海光DCU软件栈年度版本。
海光信息,sh.688041,2026-04-03,原文信息不足，无法形成完整摘要。
海光信息,sh.688041,2026-04-03,原文信息不足，无法形成完整摘要。
海光信息,sh.688041,2026-04-03,原文信息不足，无法形成完整摘要。
海光信息,sh.688041,2026-04-03,海光信息技术股份有限公司于2026年4月3日发生一笔大宗交易，成交金额为1068.85万元。该公司成立于2014年10月24日，注册资本为232433.8091万人民币。
