code_name,ticker,created_at,text
工商银行,sh.601398,2025-10-31,工商银行于2025年10月30日发布H股公告，披露董事会成员名单和八个委员会的组成。执行董事包括廖林（董事长）、刘珺（副董事长、行长）、段红涛、王景武（副行长）；非执行董事为卢永真、曹利群、董阳、钟蔓桃；独立非执行董事为陈德霖、赫伯特·沃特、莫里·洪恩、陈关亭、李伟平。董事会下设战略、社会责任、审计、风险管理、提名、薪酬、关联交易
工商银行,sh.601398,2025-10-31,工商银行于2025年10月30日在北京召开董事会，应出席董事13名，实际出席12名。会议审议通过2025年第三季度报告及“工行优1”股息分配议案，两项议案均以13票全票通过。根据决议，工商银行将于2025年11月24日派发境内优先股“工行优1”股息，金额为20.61亿元人民币。
工商银行,sh.601398,2025-10-31,工商银行于2025年10月31日发布H股公告，披露董事会审计委员会工作规则（2025年版）。规则明确了委员会由3名以上非执行董事组成，独立董事占比过半，主席由独立董事中的会计专业人士担任。委员会主要职责包括监督内部控制、财务信息、内部审计，并对董事及高管履职行为进行监督。该规则自董事会批准之日起生效。
工商银行,sh.601398,2025-10-31,"工商银行发布2025年第三季度报告。第三季度营业收入201,886百万元，同比增长2.42%；归母净利润101,805百万元，同比增长3.29%。前三季度营业收入610,968百万元，同比增长1.98%；"
工商银行,sh.601398,2025-10-31,原文信息不足，无法形成完整摘要。
工商银行,sh.601398,2025-10-31,原文信息不足，无法形成完整摘要。
