code_name,ticker,created_at,text
工商银行,sh.601398,2026-03-13,工商银行浙江省分行向衢州发展出具股票回购专项贷款承诺函，贷款金额不超过1.8亿元，期限3年，有效期12个月。
工商银行,sh.601398,2026-03-13,中国工商银行浙江省分行原党委书记、行长沈荣勤因严重违纪违法，被中央纪委国家监委驻中国工商银行纪检监察组和辽宁省锦州市监委立案审查调查，最终被开除党籍。
工商银行,sh.601398,2026-03-13,工商银行于2026年3月13日发生一笔大宗交易，成交700万股，成交额5012万元，占当日总成交额的2.25%。成交价为7.16元，较当日收盘价7.2元折价0.56%。
工商银行,sh.601398,2026-03-13,中国工商银行浙江省分行原党委书记、行长沈荣勤因严重违纪违法问题，被中央纪委国家监委驻中国工商银行纪检监察组和辽宁省锦州市监委立案审查调查，并已被开除党籍。该消息于2026年3月13日由人民财讯发布。
工商银行,sh.601398,2026-03-13,工商银行浙江省分行原党委书记、行长沈荣勤因严重违纪违法被立案审查调查，并被开除党籍。该信息于2026年3月13日由中央纪委国家监委网站披露，中央纪委国家监委驻工商银行纪检监察组与辽宁省锦州市监委联合办理此案。
工商银行,sh.601398,2026-03-13,工商银行于2026年3月13日发生一笔大宗交易，成交700.00万股，成交额5012.00万元。公司成立于1985年11月22日，注册资本约3564.06亿元。
工商银行,sh.601398,2026-03-13,中国工商银行浙江省分行原党委书记、行长沈荣勤因严重违纪违法，经中央纪委国家监委驻中国工商银行纪检监察组和辽宁省锦州市监委立案审查调查，已被开除党籍。该消息于2026年3月13日由蓝鲸新闻发布。
