code_name,ticker,created_at,text
工商银行,sh.601398,2026-04-07,工商银行发布2026年第一次临时股东会回执。会议将于2026年4月23日下午2时50分在北京市西城区复兴门内大街55号总行举行。持有H股的股东需在4月18日前将填妥并签署的回执送达董事会办公室或香港中央证券登记有限公司。
工商银行,sh.601398,2026-04-07,工商银行（1398.HK）发布通知，将于2026年4月23日在北京总行召开第一次临时股东会，审议2025年度财务决算方案、利润分配方案（建议每股派发末期股息0.1689元人民币）及2026年度固定资产投资预算。H股股份过户登记将于4月20日至23日暂停，股息预计不晚于6月16日支付。
工商银行,sh.601398,2026-04-07,工商银行将于2026年4月23日召开临时股东会，审议2025年度利润分配方案及2026年度固定资产投资预算等议案。2025年度拟派发末期现金股息601.97亿元（每10股1.689元），全年每10股派3.103元，总派息额1105.93亿元，占归母净利润30%。2026年度新增固定资产投资预算135亿元，其中金融科技61亿元、渠道建设43亿元。A股及H股股权登记日为2026年5月12日。
工商银行,sh.601398,2026-04-07,工商银行发布海外监管公告，披露2026年第一次临时股东会会议资料。2025年集团实现净利润3707.66亿元，同比增长1.0%；不良贷款率1.31%，较年初下降0.03个百分点；拨备覆盖率213.60%；资本充足率18.76%。利润分配方案为每10股派发人民币3.103元（含税），总派息额1105.93亿元，占归母净利润30.0%。2026年度新增固定资产投资预算135亿元，其中金融科技61亿元。
工商银行,sh.601398,2026-04-07,工商银行将于2026年4月23日下午2时50分在北京总行召开2026年第一次临时股东会，会议将审议2025年度财务决算方案、利润分配方案及2026年度固定资产投资预算等三项普通决议案。该代表委任表格供H股股东委任代表出席并投票，需在会议前24小时送达指定登记处。
工商银行,sh.601398,2026-04-07,工商银行于2026年4月7日公告，截至2025年12月31日止年度末期股息为每10股1.689元人民币，普通股息，股东批准日期为2026年4月23日，除净日为2026年5月4日，股息派发日为2026年6月16日。其他信息如汇率及代扣所得税有待公布。
工商银行,sh.601398,2026-04-07,多家上市银行在年报中披露已建立“反向讨薪”制度并执行，其中中国银行三年内追回金额超亿元。工商银行、招商银行、民生银行等虽明确表示已建立相关制度，但未披露具体追索金额。
