code_name,ticker,created_at,text
保利发展,sh.600048,2025-12-11,据2025年12月11日华夏时报网消息，房贷贴息传闻引发地产股上涨，万科A、财信发展、华夏幸福、广宇集团涨停，沙河股份、金地集团、保利发展涨幅超过5%。
保利发展,sh.600048,2025-12-11,2025年12月11日，租售同权概念板块下跌3.19%。数据显示，板块内有9只个股主力资金净流出超3000万元。其中，万科A下跌3.43%，主力资金净流出4.46亿元；张江高科下跌2.79%，主力资金净流出1.64亿元；保利发展下跌3.89%，主力资金净流出。
保利发展,sh.600048,2025-12-11,房地产行业资金流出榜显示，万科A等6只股票当日净流出资金均超亿元，涉及万通发展、张江高科、华夏幸福、海南机场等个股。
保利发展,sh.600048,2025-12-11,保利发展于2025年12月11日在互动平台回应投资者提问，称公司目前经营情况正常。
保利发展,sh.600048,2025-12-11,保利发展于2025年12月11日回应投资者提问，表示公司在任董事、高管自2022年1月增持计划实施完毕后至今未进行减持。公司称将结合行业态势与经营安排，综合开展市值管理工作。
保利发展,sh.600048,2025-12-11,保利发展于2025年12月11日在互动平台表示，公司目前经营正常，持续推进销售去化和优质增量拓展，具有充足现金流安全垫，有信心保障债务偿还和增量投资。玥玺湾等新增项目首开效果好，产品力获市场认可，立项标准兑现度高，相关项目利润需在交付结转时体现。
保利发展,sh.600048,2025-12-11,保利发展于2025年12月11日在互动平台表示，将结合行业发展态势和经营安排，综合开展各项市值管理工作。
