code_name,ticker,created_at,text
保利发展,sh.600048,2026-02-13,保利发展于2026年2月13日发布2025年度向特定对象发行可转换公司债券募集说明书（修订稿），披露了公司面临的政策、经营、财务等多方面风险。其中提到：2024年度营业收入同比下降10.14%，净利润同比下降58.56%；2025年前三季度营业收入同比下降4.95%，净利润同比下降75.31%；预计2025年度营业收入同比下降1.09%，净利润同比下降79.49%。公司资产负债率呈下降趋势，但存货、长期股权投资等存在减值风险。
保利发展,sh.600048,2026-02-13,保利发展对上海证券交易所关于其向特定对象发行可转换公司债券的审核问询函作出回复。立信会计师事务所对募投项目进行核查。此次募集资金拟用于杭州保利天奕、石家庄保利裕华天珺等9个普通住宅项目，仅用于建设安装工程费及配套设施建设费等资本性支出。回复详细说明了各项目投资构成、测算依据及毛利率情况，并称相关测算已获立项批复。
保利发展,sh.600048,2026-02-13,保利发展2025年度拟向特定对象发行可转换公司债券，北京德恒律师事务所出具补充法律意见（一），回应上交所审核问询函。本次募集资金拟投向9个在建普通住宅项目，均为全资持股、已取得合法证照并开始建设、已取得预售证并开始预售的项目，面向刚需型或改善型客户，属于“保交楼、保民生”项目。项目位于上海、杭州、广州、佛山等地，均已开工，预售情况良好。
保利发展,sh.600048,2026-02-13,保利发展计划于2025年度向特定对象发行可转换公司债券，并在上海证券交易所挂牌转让。中国国际金融股份有限公司担任本次发行的保荐机构，于2026年2月出具挂牌转让保荐书。该保荐书依据相关法律法规出具，并保证真实、准确、完整。
保利发展,sh.600048,2026-02-13,保利发展拟向特定对象发行可转换公司债券，募集资金总额不超过50亿元（含本数），保荐机构为中金公司。该申请已向中国证监会和上交所提交，中金公司出具了发行保荐书，并指定马丰明、刘昀为保荐代表人。
保利发展,sh.600048,2026-02-13,保利发展于2026年1月19日收到上交所关于其2025年度向特定对象发行可转换公司债券申请文件的审核问询函。公司回复称，募集资金拟投向杭州保利天奕、石家庄保利裕华天珺等9个在建普通住宅项目，均面向刚需或改善型客户，已开工并预售，属于“保交楼、保民生”项目。项目分布于上海、杭州、广州等地，预计收益良好。
保利发展,sh.600048,2026-02-13,保利发展控股集团股份有限公司于2026年2月13日发布公告，披露其2025年度向特定对象发行可转换公司债券的申请文件已更新，包括对交易所审核问询函的回复及募集说明书等文件。
